<?xml version="1.0" encoding="utf-8"?>
 <Lista xmlns:xsi="http://www.w3.org/2001/XMLSchema-instance" 
xsi:noNamespaceSchemaLocation="curso.xsd">
	<Curso>
		<Titulo>Lenguaje de Marcas</Titulo>
		<Horas>200</Horas>
		<diaComienzo>L</diaComienzo> <!-- L MA MI J V -->
		<talla1>S</talla1> <!-- S M L XL 36...44 -->
		<talla2>XL</talla2> <!-- S M L XL un numero entero -->
		<valoracion>true</valoracion> <!-- true false o un entero -->
	</Curso>
	<Curso>
		<Titulo>BBDD</Titulo>
		<Horas>210</Horas>
		<diaComienzo>L</diaComienzo> <!-- L MA MI J V -->
		<talla1>44</talla1> <!-- S M L XL 36...44 -->
		<talla2>50</talla2> <!-- S M L XL un numero entero -->
		<valoracion>30</valoracion> <!-- true false o un entero -->
	</Curso>
 </Lista>

<!-- con el simpletype dentro -->